{
  "id": "00000000-0000-4000-8000-000000000002",
  "actor": "agent:example-synthetic",
  "action": "actions.execute.dry_run",
  "resource": "entity:999000111",
  "hash": "0000000000000000000000000000000000000000000000000000000000000000",
  "previous_hash": null,
  "occurred_at": "2026-06-27T09:00:00Z"
}
